{
  "schemaVersion": 1,
  "ledgerId": "requirement_status_ledger_dataset_management_v1",
  "baselineId": "governance_baseline_dataset_management_v1",
  "requirements": [
    {
      "requirementId": "SRC-01",
      "requirementType": "SOURCE_REQUIREMENT",
      "status": "PLANNED",
      "owner": "MAIN_AGENT",
      "independentAcceptor": "UNASSIGNED_INDEPENDENT_ACCEPTOR",
      "inputArtifacts": [{"path": "docs/dataset-management-ui-phased-acceptance.md", "sha256": "28e38cbd891751b08d2cb3d9f58bd945441de7ceae956b3081cd95c7da99bd1d", "state": "VERIFIED"}],
      "outputArtifacts": [{"path": "docs/phase-records/phase-7-execution-record.md", "sha256": null, "state": "PENDING"}],
      "acceptanceEvidence": [{"path": "docs/phase-records/phase-7-execution-record.md", "sha256": null, "state": "PENDING"}]
    },
    {
      "requirementId": "SRC-02",
      "requirementType": "SOURCE_REQUIREMENT",
      "status": "PLANNED",
      "owner": "WP8_OWNER",
      "independentAcceptor": "UNASSIGNED_INDEPENDENT_ACCEPTOR",
      "inputArtifacts": [{"path": "docs/semantic-requirements-ledger.md", "sha256": "5e4f1bd6ec6bccf2f787408965db17f1710996f8a4bddacad9bd37e474ed2689", "state": "VERIFIED"}],
      "outputArtifacts": [{"path": "docs/semantic-benchmark/benchmark-manifest.json", "sha256": null, "state": "BLOCKED"}],
      "acceptanceEvidence": [{"path": "docs/phase-records/phase-7-execution-record.md", "sha256": null, "state": "PENDING"}]
    },
    {
      "requirementId": "SRC-03",
      "requirementType": "SOURCE_REQUIREMENT",
      "status": "PLANNED",
      "owner": "MAIN_AGENT",
      "independentAcceptor": "UNASSIGNED_INDEPENDENT_ACCEPTOR",
      "inputArtifacts": [{"path": "docs/dataset-management-ui-phased-acceptance.md", "sha256": "28e38cbd891751b08d2cb3d9f58bd945441de7ceae956b3081cd95c7da99bd1d", "state": "VERIFIED"}],
      "outputArtifacts": [{"path": "docs/phase-records/phase-7-execution-record.md", "sha256": null, "state": "PENDING"}],
      "acceptanceEvidence": [{"path": "docs/phase-records/phase-7-execution-record.md", "sha256": null, "state": "PENDING"}]
    },
    {
      "requirementId": "SRC-04",
      "requirementType": "SOURCE_REQUIREMENT",
      "status": "PLANNED",
      "owner": "WP8_OWNER",
      "independentAcceptor": "UNASSIGNED_INDEPENDENT_ACCEPTOR",
      "inputArtifacts": [{"path": "docs/semantic-requirements-ledger.md", "sha256": "5e4f1bd6ec6bccf2f787408965db17f1710996f8a4bddacad9bd37e474ed2689", "state": "VERIFIED"}],
      "outputArtifacts": [{"path": "docs/phase-records/phase-7-execution-record.md", "sha256": null, "state": "PENDING"}],
      "acceptanceEvidence": [{"path": "docs/phase-records/phase-7-execution-record.md", "sha256": null, "state": "PENDING"}]
    },
    {
      "requirementId": "SRC-05",
      "requirementType": "SOURCE_REQUIREMENT",
      "status": "PLANNED",
      "owner": "MAIN_AGENT",
      "independentAcceptor": "UNASSIGNED_INDEPENDENT_ACCEPTOR",
      "inputArtifacts": [{"path": "docs/semantic-contracts/contract-manifest.json", "sha256": "5a21d7dfafb8909307067b7f103937d5ecbbcbcd481d9cf355a868f4bcba4ed5", "state": "VERIFIED"}, {"path": "docs/semantic-contracts/semantic-contract-rfc.md", "sha256": "037b0093ead76511ac2b12f2067f445e13041418f5917056121cc490b3298e98", "state": "VERIFIED"}],
      "outputArtifacts": [{"path": "docs/phase-records/phase-5-execution-record.md", "sha256": null, "state": "PENDING"}],
      "acceptanceEvidence": [{"path": "docs/phase-records/phase-5-execution-record.md", "sha256": null, "state": "PENDING"}]
    },
    {
      "requirementId": "SRC-06",
      "requirementType": "SOURCE_REQUIREMENT",
      "status": "PLANNED",
      "owner": "WP5_OWNER",
      "independentAcceptor": "UNASSIGNED_INDEPENDENT_ACCEPTOR",
      "inputArtifacts": [{"path": "docs/semantic-contracts/contract-manifest.json", "sha256": "5a21d7dfafb8909307067b7f103937d5ecbbcbcd481d9cf355a868f4bcba4ed5", "state": "VERIFIED"}, {"path": "docs/semantic-contracts/semantic-contract-rfc.md", "sha256": "037b0093ead76511ac2b12f2067f445e13041418f5917056121cc490b3298e98", "state": "VERIFIED"}],
      "outputArtifacts": [{"path": "docs/phase-records/phase-5-execution-record.md", "sha256": null, "state": "PENDING"}],
      "acceptanceEvidence": [{"path": "docs/phase-records/phase-5-execution-record.md", "sha256": null, "state": "PENDING"}]
    },
    {
      "requirementId": "SRC-07",
      "requirementType": "SOURCE_REQUIREMENT",
      "status": "PLANNED",
      "owner": "WP5_OWNER",
      "independentAcceptor": "UNASSIGNED_INDEPENDENT_ACCEPTOR",
      "inputArtifacts": [{"path": "docs/semantic-contracts/contract-manifest.json", "sha256": "5a21d7dfafb8909307067b7f103937d5ecbbcbcd481d9cf355a868f4bcba4ed5", "state": "VERIFIED"}, {"path": "docs/semantic-contracts/semantic-contract-rfc.md", "sha256": "037b0093ead76511ac2b12f2067f445e13041418f5917056121cc490b3298e98", "state": "VERIFIED"}],
      "outputArtifacts": [{"path": "docs/phase-records/phase-5-execution-record.md", "sha256": null, "state": "PENDING"}],
      "acceptanceEvidence": [{"path": "docs/phase-records/phase-5-execution-record.md", "sha256": null, "state": "PENDING"}]
    },
    {
      "requirementId": "SRC-08",
      "requirementType": "SOURCE_REQUIREMENT",
      "status": "PLANNED",
      "owner": "WP2_OWNER",
      "independentAcceptor": "UNASSIGNED_INDEPENDENT_ACCEPTOR",
      "inputArtifacts": [{"path": "docs/semantic-contracts/contract-manifest.json", "sha256": "5a21d7dfafb8909307067b7f103937d5ecbbcbcd481d9cf355a868f4bcba4ed5", "state": "VERIFIED"}],
      "outputArtifacts": [{"path": "docs/phase-records/phase-2-execution-record.md", "sha256": null, "state": "PENDING"}],
      "acceptanceEvidence": [{"path": "docs/phase-records/phase-2-execution-record.md", "sha256": null, "state": "PENDING"}]
    },
    {
      "requirementId": "SRC-09",
      "requirementType": "SOURCE_REQUIREMENT",
      "status": "PLANNED",
      "owner": "WP3_OWNER",
      "independentAcceptor": "UNASSIGNED_INDEPENDENT_ACCEPTOR",
      "inputArtifacts": [{"path": "docs/semantic-contracts/contract-manifest.json", "sha256": "5a21d7dfafb8909307067b7f103937d5ecbbcbcd481d9cf355a868f4bcba4ed5", "state": "VERIFIED"}, {"path": "docs/semantic-contracts/semantic-contract-rfc.md", "sha256": "037b0093ead76511ac2b12f2067f445e13041418f5917056121cc490b3298e98", "state": "VERIFIED"}],
      "outputArtifacts": [{"path": "docs/phase-records/phase-3-execution-record.md", "sha256": null, "state": "PENDING"}],
      "acceptanceEvidence": [{"path": "docs/phase-records/phase-3-execution-record.md", "sha256": null, "state": "PENDING"}]
    },
    {
      "requirementId": "SRC-10",
      "requirementType": "SOURCE_REQUIREMENT",
      "status": "BLOCKED",
      "owner": "WP4_OWNER",
      "independentAcceptor": "UNASSIGNED_INDEPENDENT_ACCEPTOR",
      "inputArtifacts": [{"path": "docs/semantic-contracts/job-runtime-semantics-v1.json", "sha256": "9c16628857b0e2c402da5fba31ab0146487315615b2881421ecd0090dbab5adc", "state": "VERIFIED"}],
      "outputArtifacts": [{"path": "docs/phase-records/phase-4-execution-record.md", "sha256": null, "state": "BLOCKED"}],
      "acceptanceEvidence": [{"path": "docs/phase-records/phase-4-execution-record.md", "sha256": null, "state": "BLOCKED"}]
    },
    {
      "requirementId": "SRC-11",
      "requirementType": "SOURCE_REQUIREMENT",
      "status": "BLOCKED",
      "owner": "WP4_OWNER",
      "independentAcceptor": "UNASSIGNED_INDEPENDENT_ACCEPTOR",
      "inputArtifacts": [{"path": "docs/semantic-contracts/job-runtime-semantics-v1.json", "sha256": "9c16628857b0e2c402da5fba31ab0146487315615b2881421ecd0090dbab5adc", "state": "VERIFIED"}, {"path": "docs/semantic-contracts/semantic-contract-rfc.md", "sha256": "037b0093ead76511ac2b12f2067f445e13041418f5917056121cc490b3298e98", "state": "VERIFIED"}],
      "outputArtifacts": [{"path": "docs/phase-records/phase-4-execution-record.md", "sha256": null, "state": "BLOCKED"}],
      "acceptanceEvidence": [{"path": "docs/phase-records/phase-4-execution-record.md", "sha256": null, "state": "BLOCKED"}]
    },
    {
      "requirementId": "SRC-12",
      "requirementType": "SOURCE_REQUIREMENT",
      "status": "PLANNED",
      "owner": "WP4_OWNER",
      "independentAcceptor": "UNASSIGNED_INDEPENDENT_ACCEPTOR",
      "inputArtifacts": [{"path": "docs/semantic-contracts/contract-manifest.json", "sha256": "5a21d7dfafb8909307067b7f103937d5ecbbcbcd481d9cf355a868f4bcba4ed5", "state": "VERIFIED"}],
      "outputArtifacts": [{"path": "docs/phase-records/phase-4-execution-record.md", "sha256": null, "state": "PENDING"}],
      "acceptanceEvidence": [{"path": "docs/phase-records/phase-4-execution-record.md", "sha256": null, "state": "PENDING"}]
    },
    {
      "requirementId": "SRC-13",
      "requirementType": "SOURCE_REQUIREMENT",
      "status": "PLANNED",
      "owner": "WP5_OWNER",
      "independentAcceptor": "UNASSIGNED_INDEPENDENT_ACCEPTOR",
      "inputArtifacts": [{"path": "docs/semantic-contracts/contract-manifest.json", "sha256": "5a21d7dfafb8909307067b7f103937d5ecbbcbcd481d9cf355a868f4bcba4ed5", "state": "VERIFIED"}],
      "outputArtifacts": [{"path": "docs/phase-records/phase-5-execution-record.md", "sha256": null, "state": "PENDING"}],
      "acceptanceEvidence": [{"path": "docs/phase-records/phase-5-execution-record.md", "sha256": null, "state": "PENDING"}]
    },
    {
      "requirementId": "SRC-14",
      "requirementType": "SOURCE_REQUIREMENT",
      "status": "PLANNED",
      "owner": "WP6_OWNER",
      "independentAcceptor": "UNASSIGNED_INDEPENDENT_ACCEPTOR",
      "inputArtifacts": [{"path": "docs/semantic-contracts/contract-manifest.json", "sha256": "5a21d7dfafb8909307067b7f103937d5ecbbcbcd481d9cf355a868f4bcba4ed5", "state": "VERIFIED"}],
      "outputArtifacts": [{"path": "docs/phase-records/phase-6-execution-record.md", "sha256": null, "state": "PENDING"}],
      "acceptanceEvidence": [{"path": "docs/phase-records/phase-6-execution-record.md", "sha256": null, "state": "PENDING"}]